{"capture_revision_id":"81e4985b-3169-49a4-b76c-8316a7145117","capture_series_id":"84c9800c-33b7-4c66-8ef3-3616954fcd1a","capture_session_id":"0f936474-e29d-415d-9691-b52faed6227b","checkpoint":{"advisory_notes":[{"detail":"region=behind_sofa","kind":"declared_region","session_timestamp_seconds":20},{"detail":"flag_id=1 kind=coverage","kind":"revisit_flag","session_timestamp_seconds":22}],"benchmark_refs":[],"end_boundary_frame_ids":[],"end_coverage":{"actionable_weak_region_count":0,"algorithm":"fixture","algorithm_version":"1.0.0","cell_sample_counts":[2,2,2,2,2,2,2,2,2,2,2,2,2,2,2,2,2,2,2,2,2,2,2,2,2,2,2,2,2,2,2,2,2,2,2,2],"coverage_fraction":1,"direction_reference":"start_relative","display_unknown_region_count":0,"end_session_timestamp_seconds":26,"geometry_evidence_mode":"mesh_and_depth","guidance_complete":true,"guidance_completed_attempts":0,"guidance_completion_source":"observed","guidance_maximum_attempts":4,"latest_has_scene_depth":true,"latest_mesh_anchor_count":1,"latest_tracking_state":"normal","mesh_availability_state":"anchorsObserved","minimum_samples_per_cell":2,"movement_capability":"unrestricted","observed_region_count":1,"pitch_band_fractions":{},"remote_weak_region_count":0,"saturated_weak_region_count":0,"sector_count":12,"spatial_capacity_saturated":false,"spatial_cell_size_meters":0.5,"spatial_max_region_count":256,"spatial_peak_region_count":1,"spatial_region_eviction_count":0,"uses_depth_fallback":false,"vertical_band_summaries":{"middle":{"observed_count":8,"voxel_count":8,"weak_count":0}},"vertical_cell_size_meters":0.3,"vertical_observed_voxel_count":8,"vertical_voxel_count":8,"vertical_weak_voxel_count":0,"vertical_weak_voxel_keys":[],"viewpoint_diversity_semantics":"azimuth_elevation_3d","weak_cells":[],"weak_region_count":0,"weak_region_keys":[]},"field_notes":[{"authoring_method":"typed","binding_refs":[],"capture_revision_id":"81e4985b-3169-49a4-b76c-8316a7145117","capture_session_id":"0f936474-e29d-415d-9691-b52faed6227b","category":"room_condition","created_at":"2026-10-03T01:42:46Z","evidence_refs":[],"needs_attention":false,"note_id":"d532358a-c7c3-4e90-9473-182e7304b9f8","status":"active","text":"Glass wall on the north side"}],"mesh_lifecycle":{"added_count":1,"anchors_never_updated_count":1,"anchors_updated_2_4_count":0,"anchors_updated_5plus_count":0,"anchors_updated_once_count":0,"final_active_anchors":1,"removed_count":0,"truncated":false,"unique_anchors_observed":1,"updated_count":0},"resource_events":[{"detail":"transient memory pressure at second 30","kind":"memory_pressure","severity":"warning"}],"retention_kinds":{},"roomplan_guidance_available":false,"skipped_task_requirement_ids":[],"task_profile":{"identifier":"theater_layout","requirements":[{"allows_skipped_outcome":false,"identifier":"primary_listening_position","is_optional":false,"match":{"endpoint_refs":[],"kind":"annotation_entity_type","value":"listening_position"},"maximum_count":1,"minimum_count":1},{"allows_skipped_outcome":false,"alternative_group":"screen_presence","identifier":"screen_or_display","is_optional":false,"match":{"endpoint_refs":[],"kind":"annotation_entity_type","value":"display"},"minimum_count":1},{"allows_skipped_outcome":false,"alternative_group":"screen_presence","identifier":"screen_or_display_projection","is_optional":false,"match":{"endpoint_refs":[],"kind":"annotation_entity_type","value":"projection_screen"},"minimum_count":1},{"allows_skipped_outcome":false,"identifier":"speaker_role_C","is_optional":false,"match":{"endpoint_refs":[],"kind":"annotation_channel_role","value":"C"},"minimum_count":1},{"allows_skipped_outcome":false,"identifier":"speaker_role_L","is_optional":false,"match":{"endpoint_refs":[],"kind":"annotation_channel_role","value":"L"},"minimum_count":1},{"allows_skipped_outcome":false,"identifier":"speaker_role_R","is_optional":false,"match":{"endpoint_refs":[],"kind":"annotation_channel_role","value":"R"},"minimum_count":1},{"allows_skipped_outcome":false,"identifier":"speaker_role_SBL","is_optional":false,"match":{"endpoint_refs":[],"kind":"annotation_channel_role","value":"SBL"},"minimum_count":1},{"allows_skipped_outcome":false,"identifier":"speaker_role_SBR","is_optional":false,"match":{"endpoint_refs":[],"kind":"annotation_channel_role","value":"SBR"},"minimum_count":1},{"allows_skipped_outcome":false,"identifier":"speaker_role_SL","is_optional":false,"match":{"endpoint_refs":[],"kind":"annotation_channel_role","value":"SL"},"minimum_count":1},{"allows_skipped_outcome":false,"identifier":"speaker_role_SR","is_optional":false,"match":{"endpoint_refs":[],"kind":"annotation_channel_role","value":"SR"},"minimum_count":1},{"allows_skipped_outcome":false,"identifier":"speaker_role_TFL","is_optional":false,"match":{"endpoint_refs":[],"kind":"annotation_channel_role","value":"TFL"},"minimum_count":1},{"allows_skipped_outcome":false,"identifier":"speaker_role_TFR","is_optional":false,"match":{"endpoint_refs":[],"kind":"annotation_channel_role","value":"TFR"},"minimum_count":1},{"allows_skipped_outcome":false,"identifier":"speaker_role_TRL","is_optional":false,"match":{"endpoint_refs":[],"kind":"annotation_channel_role","value":"TRL"},"minimum_count":1},{"allows_skipped_outcome":false,"identifier":"speaker_role_TRR","is_optional":false,"match":{"endpoint_refs":[],"kind":"annotation_channel_role","value":"TRR"},"minimum_count":1},{"allows_skipped_outcome":false,"identifier":"subwoofers","is_optional":false,"match":{"endpoint_refs":[],"kind":"annotation_channel_role","value":"LFE"},"minimum_count":1}],"title":"Theater layout"},"tracking_intervals":[{"first_seconds":1,"last_seconds":1,"sample_count":1,"state":"normal"},{"first_seconds":5,"last_seconds":5,"reason":"excessive_motion","sample_count":1,"state":"unavailable"},{"first_seconds":12,"last_seconds":25,"sample_count":2,"state":"normal"}]},"coordinate_space_id":"893addc6-b4b6-4cb4-8da2-67c64765ffa5","created_at_utc":"2026-10-03T01:42:46Z","phase":"ready_to_finalize","practice":false,"schema":"htdt.working-revision-state","schema_version":"1.0.0","updated_at_utc":"2026-10-03T01:42:46Z"}